<!ELEMENT employees (employee+)>
<!ELEMENT employee (empID, name, department, designation, email, salary)>
<!ELEMENT empID (#PCDATA)>
<!ELEMENT name (#PCDATA)>
<!ELEMENT department (#PCDATA)>
<!ELEMENT designation (#PCDATA)>
<!ELEMENT email (#PCDATA)>
<!ELEMENT salary (#PCDATA)>
